,Title,email,KeyWords,Abstract,domain,Institution,Country,Latitude,Longitude
39,ADMISSION CRITERIA FOR ENGINEERING MANAGEMENT MASTER’S DEGREE PROGRAMS IN THE UNITED STATES,@uidaho.edu,"engineering management master’s degree, admission criteria","Engineering Management master’s degree programs at every institution have admission criteria. However, what constitutes admission criteria varies from one program to the next. There are quantitative criteria that exist for nearly all programs, such as the undergraduate grade point average (GPA) and the Graduate Record Exam (GRE). Acceptable values of these criteria vary from one program to the next .  The re are more qualitative criteria, such as letters of recommendation, which are difficult to assess. Furthermore, admission decisions based on these criteria are not absolute as there are provisions for relaxing the acceptance level of the criteria so that students who do not meet the standard can still be admitted into the program.  These situations raise questions as to the purpose of admission criteria, their value, and how they are applied. There are also concerns as to the barriers imposed by admission criteria and if they unnecessarily reduce access to degree pursuit.  In this paper we present information from a variety of sources to provide a better understanding of these issues.  We also summarize the acceptance criteria currently used by 30 engineering management master’s degree programs in the United States to characterize how they are applied. Finally, we make recommendations that engineering management master’s degree programs may consider, along with identifying areas for further study on this topic. Keywords engineering management master’s degree, admission criteria Introduction All degree programs select and admit students based on admission criteria. Engineering management master’s degree programs are no different  though what constitutes required admission criteria vary from one program to the next. Some admission criteria have specific  numerical values such as grade point average (GPA)  or Graduate Record Examination (GRE) (ETS GRE, 2024). These type of criteria  lend themselves to more objective  decision making in graduate admissions.  Many admission criteria do not have numerical values such as letters  of recommendation or a student’s resume. These type of criteria lend themselves to more subjective decision making in graduate admissions. In combination, educational programs use these admission criteria to determine who to admit into their programs and those not to admit. The objective of this paper is to describe the use and purpose of admission criteria and summarize how 30 engineering management master’s degree programs in the U.S. use them in the admissions process. The nature of the students admitted into a program have a significant impact  on the nature of the students that graduate, impacting the reputatio n of the program.  Furthermore, increased student mobility and graduate applicants from different higher education systems , levels of academic skills, and pro ficiency in English language make the admissions process that much more challenging (Kurysheva , et. al., 2023).  Therefore, faculty are very concerned about who they admit and the need for admission criteria to guide their decisions. The primary purpose for having admission criteria  is a desire to admit students into the program  who will be successful at completing all of the requirements of the program and obtain the degree. Degree obtainment is important so that time and financial resources of both the institution and the student are not expended  if the educational pursuit is not completed.  Therefore admission criteria are used to identify students most likely to succeed. Another purpose of admission criteria is to help develop a particular characteristic for a program known as brand identity.  This enables a program to graduate students that have a characteristic background and promote a particular capability to those employing the graduates.  This includes s tudents that help  the program pursue its mission and achieve its vision.",uidaho.edu,University of Idaho,United States,46.72379775,-117.02043898436474
40,A SET-BASED KNOWLEDGE GENERATION FRAMEWORK FOR PRODUCT DEVELOPMENT,@montana.edu,"Set-Based Concurrent Engineering, Product Development, Knowledge Management","The product development process involves a series of complex tasks with engineers facing diverse, often conflicting objectives. The traditional model, c haracterized by identifying the “best” solution early and iteratively modifying it until requirements are met, presents hurdles related to product cost, management's diminishing ability to influence the project as it progresses, and limited knowledge avail ability when key decisions are made. However, front -loading counters these issues by shifting problem -solving to earlier stages of development. By exploring a broader design space earlier in the process, engineers can refine solutions before committing to one. In doing so, front -loading mitigates the above challenges, reducing the need for late engineering changes and fostering continuous improvement. One approach for front -loading is Set -Based Concurrent Engineering (SBCE). A key principle of SBCE is to “m ap the design space,” which aligns with the concept of knowledge generation. “Map the design space” refers to building knowledge about different combinations of design parameters, considering constraints and trade -offs to foster cross- functional understanding. In this paper, we introduce a set -based knowledge generation framework through a comprehensive literature review, synthesizing existing research on front -loading, SBCE, sys tems engineering and knowledge management. The framework offers a step -by-step approach to identifying knowledge requirements in design spaces characterized by multiple objectives and design parameters. Additionally, the framework includes a management sys tem that facilitates the generation of knowledge. By providing organizations with a systematic approach to set -based knowledge generation, the framework aims to enhance decision -making processes in product development, optimize resource allocation, and streamline innovation efforts. Keywords Set-Based Concurrent Engineering, Product Development, Knowledge Management Introduction Product development encompasses the business process through which a company transforms innovation into market- ready offerings (Cantamessa & Montagna, 2016). It represents the tangible result of the research and innovation journey, converting ideas into commercially viable products that meet the needs of end -users and contribute to economic value. Whether it’s Apple, Tesla, or Ube r, innovative products and services shape our lifestyle and inspire new ways of living. Despite its significance, not all companies excel in introducing new products. Harvard professor Clay Christensen highlights that 95% of new products fail (Nobel, 2011) . Typical product development processes aim to quickly develop and choose a single design concept, essentially pinpointing a single spot within the design space. Three key factors impede the effectiveness of this point -based product development approach: 1) product cost implications due to critical early decisions with limited data, 2) management's diminishing influence over design as the cycle progresses, and 3) the constraint of limited knowledge in initial stages, leading to relatively uninformed decisio ns. The need for rework to refine the product, coupled with late engineering changes as undesirable patches, underscores the challenge of making accurate decisions with constrained knowledge (Bernstein, 1998). To overcome these challenges, organizations ma y “front-load” the process  by advancing the identification and resolution of problems associated with the development of a new product to earlier stages and defer decision making to later  stages. This strategic shift aims to accumulate additional knowledge , affording more time for thorough exploration of diverse possibilities. This in turn leads to more informed and effective decision -making in the later stages of product development (Thomke & Fujimoto, 2000; Tuna & Windisch, 2014).  As a result of front -loading",montana.edu,Montana State University - Bozeman,United States,45.6638859,-111.07928704602077
41,DIGITAL AGGREGATION OF A DIGITAL THREAD: A SYSTEMATIC LITERATURE REVIEW,@uah.edu,"Digital thread, digital engineering, data, artificial intelligence","With an increasing prevalence of the digital transformation across multiple industries, there is a need to understand the identification, collection, s orting, and integration of data in forming a digital thread for a system. This research aims to systematically review existing peer-reviewed literature to identify methods and techniques employed for data identification, collection, sorting, and integratio n to form a digital thread. This research also explores the role of artificial intelligence (AI) in creating digital threads. By adopting a data-centric approach emphasizing a single source of truth in the digital thread, stakeholders and decision-makers have updated system information for making real-time decisions. The research contributes to the field of engineering management by providing insights into current strategies for creating a digital thread framework. While there is not a standardized method, there are identifiable patterns in the literature of forming a digital thread. Data selection methods consider factors like data gathering, storage compatibility, and relevance, primarily utilizing traditional manufacturing methods such as IoT sensors and cameras. Data storage relies on methods like SQL databases and data modeling languages to standardize the data while sorting methods vary based on factors such as life cycle stage and metadata attributes for traceability. Integration methods range from unique frameworks to combining data into a single file type. Future research includes the exploration of emerging AI and machine learning techniques for optimizing data acquisition and integration into digital threads, as well as using an AI-generated digital thread to enhance the decision-making process for engineering managers. Keywords Digital thread, digital engineering, data, artificial intelligence Introduction Creating a digital thread involves complex data aggregation processes, beginning with determ ining the relevance of data to be included, feasibly collecting data, sorting data, and ultimately integrating the data into a digital thread (Bonnard et al., 2019). However, the lack of intuitive methods and standardized approaches poses a significant barrier to practical implementation. A standardized method is necessary to select, collect, sort, and transfer data into a digital thread. This research performed a systematic literature review (SLR) to understand and contextualize the current methodologies and technologies used in the formation of digital threads. The researchers aim to bridge this gap by analyzing current methodologies and best practices for forming digital threads. By adopting a data -centric approach and emphasizing the concept of a single source of truth contained within the digital thread, engineering managers have access to updated information to make educated, real-time decisions about their systems. Digital engineering is relevant in countless applications not limited to manufacturing, infrastructure, aerospace, and power systems (Zhang et al., 2024) . Each of these applications has a unique need for implementing a digital thread. In manufacturing, the digital thread can aggregate data from machinery across a facility to better understand progress, estimate completion times and maintenance schedules, and build digital twins more capable of handling the ever-changing data flow inherent to manufacturing (Gery, 2023). Smart manufacturing includes technologies such as the Internet of Things (I oT), artificial intelligence (AI), augmented reality (AR), and big data analytics. These technologies aggregate and integrate data into a digital thread (Loaiza et al., 2023) . In aerospace applications, stakeholder requirements govern the project lifecycle . A digital thread acting as an authoritative source of truth can",uah.edu,University of Alabama at Huntsville,United States,,
42,ECONOMIC ANALYSIS OF PUMPED-HYDRO ENERGY STORAGE SCHEMES AND PRICING OF PUMPING ENERGY IN INDIA,@go.stcloudstate.edu,"Pumped storage schmes, pumping energy pricing, Levelized Cost of Electricity (LCoE).","Worldwide, the Pumped-Hydro Energy Storage Scheme (PHES) is a proven bulk energy storage system used in power grid operations. In PHES, pump energy consumption is more than its energy production and hence differential energy pricing mechanism (peak and off-peak rates) is used in developed nations. But in India, so far, no such pricing system has been adopted as the PHES installations are very few, and the existing energy calculation method accounts for pumping energy as  an expenditure. Recently, as more renewable energy generation developed in the grid, th e government has issued guidelines to promote private participation in PHES development. As the pumping energy cost occupies a major portion of the plant expenditure, an attempt is made in this paper mainly to address the ‘pumping energy pricing’ by consid ering the existing energy calculating pattern and future operation. The general economic analysis, the difference between costs (expenditure) and revenue (income) associated with the project,  was used to calculate the pumping cost. The per unit cost of pum ping energy was calculated a) for the existing plants where pumping energy is mostly fed from thermal power plants, b) peak and off-peak charges, Levelized Cost of Electricity (LCoE) method was used to arrive at the optimal pumping energy cost for a typica l standalone plant, and c) as the independent operator where pumping energy fed from their own solar and wind power plants. The outcome of this analysis would be helpful in standardizing the pumping energy cost in the Indian power sector. Keywords Pumped storage schmes, pumping energy pricing, Levelized Cost of Electricity (LCoE). Introduction Economic power generation, providing affordable cost of energy to the people has always been the priority of any government with maintaining its sustainability and reliability, in which, policy makers and engineering managers are involved in both technical and economic aspects. Maintaining power system reliability, meeting the demand growth and generation expansion are some of the tasks on technical side where as providing way for active participation of private investors towards infra structure development and designing tariffs structure suitable to various consumers such as public, industries, agriculture, investors, etc. at the rates enough to maintain the financial and operational needs of the utilities are on economical side. The structure of Indian power sector has been so designed that the policy is jointly framed by the central and respective state governments, assisted by the engineering managers who are concentrating on balancing the sale, production and purchase cost of energy while approving the tariff and projects. Presently, Indian Power Sector is facing major challenges today with the introduction of reforms, globalization, and liberalization policy of the government. The ever-increasing power demand, increase in Renewable Energy (RE) penetration and low reserve capacity of the country necessitates more energy storage schemes for the power system. The National Electricity Plan (NEP) indicates that 18.8 GW of PHES capacity and 51.5 GW of Battery Energy Storage (BES) are required to integrate the planned renewable energy capacity addition till 2032  (CEA, 2022). For many decades, PHES have been used as proven bulk energy storage systems with high capacity among other types of energy storage systems for grid integration. Though the Indian power grid needs more energy storage schemes for flexible operation, so far, only 4745.6 MW PHES schemes have been developed due to various challenges involved in PHES",go.stcloudstate.edu,,,46.3144754,11.0480288
43,CATEGORY THEORY AS A COMMON LANGUAGE OF EXPRESSION IN SYSTEMS ENGINEERING,@uah.edu,"Category theory, systems engineering, RPYS, mathematics, meta language.","With the recent interest in category theory in the systems engineering community, there is a question of what category theory brings to systems engineering that is not already contained within the mathematical approaches already found in the field. This paper suggests that category theory may be able to serve as a common means of expression, that is, a sort of “meta language” that enables different mathematical approaches within topics of systems engineering and between topics of systems engineering to be e xpressed in common terms. This paper uses reference publication year spectroscopy (RPYS) to identify seminal works related to mathematics in systems engineering and from these works identify both topics of systems engineering and math that commonly occur t ogether. It is shown that these topics of math all have links to category theory, suggesting that category theory may indeed be able to serve as a common means of expression for systems engineering. In possessing a common means of expression for systems en gineering, engineering managers may have new tools for dealing with topics such as requirements tracing, change management, and risk propagation, enabling them to more confidently ensure that their organizations will deliver soundly engineered systems that meet stakeholder needs. Keywords Category theory, systems engineering, RPYS, mathematics, meta language. Introduction Despite its focus on practice and non -mathematical topics like organizations and requirement elicitation, systems engineering (SE) is no stranger to using a range of mathematical representations on the problems it tackles. For example, Wymore (Wymore, 1993) suggested a set-theoretic approach in his work while von Bertalanffy (Bertalanffy, 2003) relied more on controls theory underpinned by differential equations. In addition to these long -established mathematical approaches, category theory is gaining more attention as a potential mathematical foundation for SE (Breiner et al., 2018; Gebreyohannes et al., 2018; Mabrok & Ryan, 2015). The question then becomes what advantages category theory offers, especially considering its reputation for being extremely challenging to learn. This paper explores one such potential advantage, that of a common means of expression within SE. Category theory s tarted life helping to recognize similarities between different topics of math, most notably algebra and topology. This ability to put seemingly disparate mathematical ideas into a common language may also be useful in SE, since different topics of SE tend  to express their thinking using different mathematical perspectives. For engineering managers in particular, the ability to express a wide collection of SE topics in a common language may offer new approaches for requirements tracing, change management, a nd risk assessment. Category theory requires making many implicit assumptions explicit, so using category theory as a common means of expression may help engineering managers identify and resolve incongruent assumptions between teams before they become larger issues. In order to begin exploring this potential advantage, a list of seminal works in SE relating to mathematical foundations was assembled, surveyed for relevance, organized by SE and mathematical topics touched on, and then",uah.edu,University of Alabama at Huntsville,United States,,
44,DEVELOPING A METHODOLOGY TO EXAMINE THE ROLE OF PROJECT CONTRACTS MANAGEMENT AS A PRECURSOR TO MANAGE PROJECTS,@vt.edu,"Project Contracts Management, Multi-Criteria Decision-Making, Project Planning and Controlling","Project Contracts Management (PCM) has gained a lot of importance recently a s strategies such as outsourcing, partnering, etc. have emerged. Since these strategies usually involve third parties, it would be significantly crucial to clarify expectations before the project starts. The goal is to prevent misunderstandings and conflic ts that can have terminating effects on the project’s success. For this reason, it can be suggested that a project closes its required contracts before it starts with the goal of increasing the project’s success probability . Therefore, PCM can be studied as a precursor to Project Management (PM), which is what this paper seeks to do. To achieve this goal, this paper proposes a PCM methodology as a precursor to manage projects. In the guide provided, Multi -Criteria Decision - Making (MCDM) is embedded as a tool to prioritize the contracts of a project. Through the use of MCDM within this framework, the paper advocates for a structured process to prioritize contracts, resulting in enhanced project outcomes. However, it is worth noting that PCM should be continuously monitored during the project and updated if necessary. The most important takeaway from this paper is that considering PCM as a precursor to PM and determining how to invest in closing different contracts of a project equips the project manager with u seful information on more efficient and effective planning and controlling of the project. To accomplish this, the methodology developed in this paper can be used. Keywords Project Contracts Management, Multi-Criteria Decision-Making, Project Planning and Controlling Introduction In recent years, the emergence of strategies such as outsourcing and partnership has resulted in significant complexity in contracts. An agreement for a project is typically reached through a bidding process or by negotiation between the two parties involved. In the past few years, outsourcing contracts for Information Technology alone were worth $100 billion (Dayanand & Padman, 2001). Contracts are important in outsourcing because outsourcing without a clearly defined contract may lead to undesirable outcomes for both parties. This research's main idea revolves around the idea that almost every activity of a project, and thus the entire project, does require at least one contract, which can be either written or oral. In light of the above explanation, it can be concluded that Project Contract s Management (PCM) is something that can be considered and planned before a project starts. This paper aims to study PCM as a precursor to Project Management (PM). Toward this goal, a framework is suggested in this paper for prioritizing and managing the contracts of a project prior to its start. Furthermore, the developed framework utilizes Multi-Criteria Decision-Making (MCDM) methods for prioritizing the contracts of a project. Even though PCM has been studied from different perspectives, little has been done to consider",vt.edu,Virginia Tech,United States,37.22192675,-80.42728184013652
