,Title,email,KeyWords,Abstract,domain,Institution,Country,Latitude,Longitude
65,A QUALITATIVE STUDY INTO THE CHALLENGES IN ADAPTINGRAILWAY INFRASTRUCTURE TO CLIMATE CHANGE: A SOUTH AFRICAN CONTEXT,@gmail.com,"Railway, Barriers, Resilience, Climate Change, Climate Impact, Adaptation, Transportation, South Africa.","This study examines challenges faced by oper ators of a South African railway in adapting their infrastructure to climate change impacts. The research aims to investigate climate impacts on railway infrastructure, existing adaptation measures, challenges in adaptation, and their influence on railway infrastructure resilience to climate impacts. One - on-one interviews were conducted with seven key participants out of fifteen invited within a single department with a population of fifty engineers and engineering managers. The study used qualitative research strategies to examine data and four qualitative research strategies to ensure reliability and validity: Prolonged Engagement, Triangulation, Member Checking, and Audit Trail. The study finds that extreme weather events such as excessive rainfall, extre me winds, and extreme temperatures significantly impact railway infrastructure. The study recommends proactive measures, adequate funding, leadership commitment, awareness and training programs, and real-time data monitoring to enhance resilience. Keywords Railway, Barriers, Resilience, Climate Change, Climate Impact, Adaptation, Transportation, South Africa. Introduction South Africa’s railway industry is facing significant challenges due to the impact of climate change.  Although the country is ra nked as the 92nd most vulnerable nation in the world to climate change, according to the World Bank Group’s 2021 climate risk profile report (The World Bank Group, 2021) , the region has already experienced several incidents of flooding (Armstrong et al., 2017; Jörn Ahrens & Halbmayer, 2023; Ngubo, 2021), indicating that climate change events can be unpredictable and universal, with detrimental impacts on railway operations and the surrounding area. In April-May 2022, unprecedented flooding resulted in significant human and economic losses, highlighting the inadequacy of civil engineering measures and maintenance of stormwater drainage systems (Jörn Ahrens & Halbmayer, 2023). Expanding research efforts and implementing adaptation measures across various  transportation modes and geographical regions is crucial to addressing these challenges effectively (Wang et al., 2023) . However, the existing literature has predominantly focused on transportation sectors in European countries, with limited attention given to other regions and recent developments in rail transport (Brito, 2022; Mclean & Becker, 2021; Wang et al., 2023) . Furthermore, there is a lack of research regarding existing railway infrastructure adaptation measures, climate impacts, implementation challenges, and their contribution to overall infrastructure resilience against climate impacts in lower- altitude regions like Africa (Brito, 2022). Therefore, this study aims to investigate climate impacts, infrastructure adaptation measures, and their contributions to overall infrastructure resilience in South Africa’s railway industry.  The study  focuses on raising awareness of climate-related challenges and encourage effective adaptation measures. The stud y findings will guide necessary adjustments in infrastructure maintenance, planning, and design considerations, reducing/mitigating climate impacts and improving infrastructure reliability.  By addressing the challenges posed by climate change, the railway industry in South Africa can continue to operate effectively while promoting sustainable development and reducing environmental risks.",gmail.com,,,46.3144754,11.0480288
66,THE INTERNATIONALIZATION OF CAMEROONIAN ENGINEERING SCHOOLS: THE EXPERIENCE OF THE NATIONAL ADVANCED SCHOOL OF PUBLIC WORKS OF YAOUNDE IN PARTNERSHIP WITH GOLDEN GATE UNIVERSITY OF SAN FRANCISCO,@yahoo.fr,"Internationalization, Partnership, Master in Engineering Management","The National Advanced School of Public Works (NASPW) of Yaoundé and Golden Gate University (GGU) of San Francisco, have set up the first degree program between Cameroon and the United States of America. This is the Master in Engineering Management. This Ma ster's program aims to equip engineers with theoretical and practical knowledge in the field of management. The courses are taught by Cameroonian and American teachers. This paternership is supported by the Embassy of the United States of America in Cameroon through the Fulbright Program, hosting conferences, books donations, which contributes to improving the quality of training. This experience is a concrete example of the internationalization of academic institutions in the Cameroonian context. The aim of this paper is to present and analyze the process of establishing and managing this partnership. In a national context where the internationalization of academic institutions is increasingly practiced, the results of this analysis will provide gu idelines likely to contribute to its improvement. This dynamic must contribute not only to meeting national challenges, but also global ones. Our experience in this partnership first consisted of working on behalf of Golden Gate University as project focal point, then as cooperation officer. In second point, the article is also part of an experience -sharing approach between the two institutions. Keywords Internationalization, Partnership, Master in Engineering Management Introduction The action of  universities on the international stage is gaining momentum worldwide. Several activities are carried out in this context such as :  the implementation of online training programs, the creation of joint training programs, the cooperation in research and co -supervision of theses, abroad programs studies, students and faculty members’mobility, among others .Termed as the internationalization of higher education, it essentially involves integrating an international, intercultural, and global dimension into the missions and functions of higher education (Knight, 2004). This definition by Jane Knight, which has been and still serves as a guide for several i nternational organizations (Organisation for Economic Cooperation and Developmment, International Association  of Universities...) and academic institutions, does not enjoy unanimous consent. The development of this phenomenon has led to diverse definitions, interpretations, and operational approaches. The characteristics (justifications, benefits, activities, results, actors) of internationalization differ from one institution to another (Knight, 2004). The partnership between GGU in San Francisco (USA), and the NASPW in Yaoundé (Cameroon), is a concrete example of the internationalization of higher education. It is important to note that international partnerships are one component of the internationalization  of higher education among others. At the university level, international partnership is characterized by a relationship between institutions located in different countries, a formal collaboration that can translate into general, specific, bilateral, or multilateral interuniversity cooperation, through which stakeholders seek mutual benefits (Leng, 2015; Tedrow and Mabobeka, 2007).",yahoo.fr,,,46.3144754,11.0480288
67,MODELLING INFORMAL WASTE COLLECTORS’ PERSPECTIVE FOR PLASTIC SOLID WASTES: ENERGY 4.0,@gmail.com,"Agent-based model, Energy and resource efficiency, Informal waste collectors, Industry 4.0.","Informal waste collectors consist of individuals, alliances, or waste dealers charged with the responsibility to sort, sell, and purchase recyclable materials. Technology has progressively been integrated into the energy sector. In this context “informal waste collections” for efficient and effective delivery of services.  The technological transformations witnessed across the globe can be attributed to  the underlying benefits of Industry 4.0 which offers numerous opportunities. This paper aims to integrate decision -support tools of Industry 4.0 for Energy and resource efficiency termed “Energy 4.0”. The real -time integrated impact assessment of energy protocols such as waste requires a skill that is valuable and can be estimated by quantitative approaches. Solid wastes can be converted into gas to produce energy hence described as one of the energy strategies. The methodology reviews the tools of Industry 4.0, specifically Agent-based simulation. To develop an integrated decision model suitable to explore the interactions and behavioral patterns of informal waste collectors’ perspectives on plastic solid wastes.  Research provides evidence of the use of agent-based models to explicitly associate and explore individuals’ behavioral attributes and etiquette with their social consequences. The outputs indicate expansive or complex relationships amongst the subsets in  context. The results enable relevant stakeholders to better discern the opportunities that the tools of Industry 4.0 provide for energy and resource efficiency. Keywords Agent-based model, Energy and resource efficiency, Informal waste collectors, Industry 4.0. Introduction Digital energy can be described as the free flow of real-time information exchanges. Waste-to-energy or energy-from- waste is the process of generating energy in the form of electricity and/or heat from the primary treatment of w aste, or the processing of waste into a fuel source . This makes waste an important component in energy management. Industry 4.0 has the potential to instantly identify and address sustainability issues aligned with the energy protocols. Energy 4.0 is a gen eral term for the collection of utility hardware, software, and technologies that leverage connectivity, data, and computing . This paper considers simulation as one of the protocols of Industry 4.0 to model informal waste collectors' perspective for an easy flow of information exchanges in real-time. The waste sector encompasses all industrial branches associated with waste management, waste recycling, and waste dumping (Owusu-Sekyere, et. al., 2022). The challenges in the waste sector are vigorous and include population growth, inadequate waste diversion, depletion of landfill airspace, and provision of unfunded waste services (Bui, et. al., 2022). In an African context, weak organizational structure s, inadequate budgets, lack of appropriate skills, lack of enforcement, weak legislation, corruption, low public awareness, conflict, lack of political will, and political instability are among many other reasons for the appalling management of waste (Debrah, et. al., 2022). The concepts of Industry 4.0 that include simulation are evident in emerging literature as suitable to develop an integrated decision-support model (Santos, et. al., 2022) . That is suitable to explore the interactions and beha vioral patterns of informal waste collectors’ perspectives on plastic solid wastes. Informal waste collectors are described as individuals or micro-enterprises responsible to intervene in waste management without being registered or formally charged with providing services for waste management (Sengupta, et. al., 2022). Research Gap",gmail.com,,,46.3144754,11.0480288
68,DIGITAL DETERMINANTS FOR INDUSTRY 4.0 READINESS: SUSTAINABLE MANUFACTURING,@gmail.com,"Industry 4.0, Simulation, Small and Medium-sized Manufacturers, Sustainability.","The COVID pandemic revealed the susceptibilities in manufacturing systems globally. Small and Medium -sized Manufacturers (SMM) are hugely impacted compared to multinational counterparts. SMM falls below certain assets, revenue, and employee thresholds but plays a key role in the stability of the global economy. Hence, sustainable practices are not only relevant to large manufacturing enterprises. Industry  4.0 enables the digital realization and management of sustainable manufacturing systems with new possibilities. This paper aims to investigate the digital determinants for industry 4.0 readiness. A mixed-method approach is considered to structure the inve stigations that facilitate simulating the digital determinants for Industry 4.0 readiness among small and medium-sized manufacturers. Simulation provides a tool suitable to investigate how a process may function as applicable in real -world scenarios. Specifically, a System Dynamics Model (SDM) is developed as a basis of the methodology and quantitative technique for the strategy development. The SDM promotes for effective feedback framework facilitating decision -making in establishing the context of this investigation. The use of a SDM provides originality to this investigation in comparison to current emerging research in a similar investigative context. The outputs from this paper demonstrate the suitability of the industry 4.0 concept specifically simulation to provide tactical and strategic business decision support for Small and Medium-sized manufacturers. The novelty in this paper allows for given sets of digital determinants in Small and Medium-sized manufacturers to be captured heterogeneously, connec ted, and recreated to interact with a capacity to transmit information and modify behaviors. Keywords Industry 4.0, Simulation, Small and Medium-sized Manufacturers, Sustainability. Introduction Small and Medium-sized Manufacturers (SMM) are essential contributors to the development of the global economy (Escoto, et. al., 2022). Rising costs & reduced revenue, managing expansion, securing & managing funds, coping with market competition, attractin g new customers, and skill & talent shortages are some of the multifaceted challenges that have influenced the sustainability of operational protocols with SMM (Escoto, et. al., 2022). The transformations of Industry 4.0 have triggered a paradigm shift in industries globally (Liu, et. al., 2022) . Emerging research is reviewing SMM preparedness to experience and sustain significant industry 4.0 changes (Liu, et. al., 2022). This paper is a valuable addition to current research by assessing the digital determinants for Industry 4.0 readiness. This is aimed at promoting sustainable manufacturing in Small and Medium -sized manufacturers. An Industry 4.0 readiness assessment accounts for an enterprise’s enthusiasm to execute changes. This includes taking on new ca pabilities, business models, and products (Ramanathan & Samaranayake, 2022). This paper explores tools of Industry 4.0 specifically simulation to develop a decision -support framework. Simulation provides an imitative representation of a process or system's functioning by means of another's functioning (Santos, et. al., 2022). A System Dynamics Model forms the basis of the entire investigation and quantitative protools for the strategy development. A decision-support framework in the form of a System Dynamics Model (SDM) is suitable to understand the dynamics and structure of the digital determinants for Industry 4.0 readiness in SMM. A SDM has demonstrated considerable value across various fields, assisting decision -makers to predict and understand th e dynamic behaviour of complex systems (Bayu, et. al., 2022).",gmail.com,,,46.3144754,11.0480288
69,AGILITY IN NEW PRODUCT DEVELOPMENT,,"New product development, agility, discipline, leadership, teams, prioritization, knowledge.","New product development (NPD) is a product company's most important function to perform and improve . Approaches and practices in new product development have evolved. These practices focus on efficiently identifying new product opportunities and rapidly iterating to determine the best new product options to advance. One common theme in modern NPD practices is agility. Whether the concept and practice of agility are focused on new product development processes or focused on the execution and delivery of the new products themselves, the ability to rapidly prototype and bring the various  people and departments involved in new product development together to work as an effective team is recognized as critical to successful new product development. This paper examines important elements of agility in NPD by revisiting new product development practices and then examining challenges to adopting them. The paper considers elements of new product development deemed critical to success in identifying new product opportunities and bringing them to market. Approaches to identi fying new ideas, gaps in organizational capability, and specific practices to ensure effective distribution of information on new product opportunities to the organization are also considered . The paper introduces the importance of prioritization and gover nance as well as leadership training and commitment in support of agile NPD . Finally, the paper addresses certain practical limitation s of agile practices in NPD, recognizing that the broad and diverse landscape of companies and organizations engaged in NPD present an equally broad and diverse set of structural and cultural challenges to adopting and maintaining agile NPD practices. Keywords New product development, agility, discipline, leadership, teams, prioritization, knowledge. Introduction: Building and Sustaining Agility in New Product Development Practices Agility is a theme that has been explored and exploited in various ways since the creation and publication of the Agile Manifesto in 2001. Rooted in manufacturing processes, quality practices, and  new product development, and built upon the collective experiences and thinking of a group of people primarily concerned with software development, the tenets of the Agile Manifesto were initially embraced by software development organizations  and extended to other technical and information technology-oriented organizations (Agile Alliance, 2001). Agile techniques and practices gained traction through the 2000s, sparking the growth of competing frameworks, certifications, and the spread of agile and agility as desirable traits for organizations well beyond the realm of software development. The 2010s saw the wider adoption of agile thinking and practices outside of software development and IT as agile theorists and practitioners expanded adoption of agile principles, the options for training and certification, and frameworks for scaling agile . In the 2020s, some outcomes and research support agility as a critical factor for organizations focused on attaining and sustaining growth and value creation. Th ose firms gain value from agility in all aspects of their operations and outpace their competition (Denning, 2024). In 2024, as even the most notable and ardent theorists and practitioners of agile thinking and frameworks reinforce the utility, practicali ty and effectiveness of agile practices in many verticals and at all levels of organizations, it is useful to recall that agile practices and thinking trace much of their inspiration and content  to concepts that were previously introduced in the realm of new product development. Companies who stake their futures on the success of their NPD organizations do well to note these concepts, revisit them, and where necessary, reinforce or adopt these practices and thinking. The best of these firms systematically and rigorously use and reinforce agility in new product development to maintain their competitive edge in all aspects of NPD, from ideation through product development and delivery. Therefore, an exploration of factors supporting the need and methods for achieving agility in NPD should start with a look at an important foundational definition of agility in NPD. In 1986, Hirotaka Takeuchi and Ikujiro Nonaka  wrote a seminal paper called “The New New Product Development Game”. In this influential Harvard Business Review article , Takeuchi and Nonaka focused on tactics used by successful and well-known companies to develop new products in ways that focused on executing the process",,,,46.3144754,11.0480288
70,THE VITRUVIAN PROGRAM: IDEAL ENGINEERING MANAGEMENT CURRICULUM FOR OPTIMAL STAKEHOLDER SATISFACTION,@uhcl.edu,"Curriculum,  Graduate Program, Stakeholder, Specializations, Content.","Under the umbrella of Engineering Management (EMGT), pursuing an ideal curriculum remains crucial to address the complex needs of the main stakeholders: students, industry, and degree programs. This study focuses on the degree program portion of the equilibrium by analyzing the ten ASEM -certified EMGT Graduate Programs. Results show that the main ten themes that emerge from content analysis are engineering, management, modeling, projects, organizations, technology, design, control, programming, and analysis. A comparison and integration with the ASEM program certification requirements leads to an ""ideal"" curriculum that covers the foundation of the Engineering Management discipline. Keywords Curriculum,  Graduate Program, Stakeholder, Specializations, Content. Introduction Students in any graduate program aspire for quality education and successful po st-graduation job placements. Meanwhile, industries seek fresh talent adept at fitting into job roles with or without the necessary training. Conversely, universities aim for high enrollment, quality students, satisfied alum ni, and fruitful collaborations with industries, including ample co-op and internship opportunities. Existing Engineering Management (EMGT) programs often provide a core curriculum with diverse specializations, yet the question is: Is there an ""ideal"" curriculum that satisfies the requirements of all stakeholders? For instance, the newly certified Master of Engineering Management and Leadership program at Rice University offers a Data Science specialization. In contrast, the University of Arkansas offe rs a Graduate Certificate in Engineering Management Analytics. By analyzing these programs, this study will distill critical insights that can inform the development of an ideal curriculum —the ""Vitruvian Program ""—that meets and exceeds stakeholders ' expectations. The outcomes of this investigation will pave the way for current and future EMGT education that optimally serves the needs of all involved parties, fostering a symbiotic relationship between academia and industry while empowering students to thrive in their careers. Literature Review In the fast-paced world of engineering management, staying ahead means constantly evolving. Technology advances rapidly, industry expectations shift, and global challenges emerge. This also means that the landscape of engineering management education is changing and continuously developing. For those pursuing a degree in this dynamic and organic field, the depth and breadth of the curriculum need to provide cutting -edge, state-of-the-art content for the graduates to be competitive in the job market. According to the 2022 ""Engineering and Engineering Technology by the Numbers "" report published by the American Society of Engineering Education (ASEE), there were 458 Bachelor's Degrees, 2,621 Master's Degrees, and 91 Doctoral Degrees awarded in Engineering Management. In 2021, these numbers were 375 for B.S., 2,836 for M.S., and 83 for Ph.D. In 2020, 668 B.S. degrees were awarded, with Master 's at 2,044 and Doctoral at 47. Notably, while undergraduate education in Engineerin g Management is on an upward trajectory, graduate education (Master 's, specifically) is following the nationwide downward trajectory. Council of Graduate Schools (2023) reports that domestic first-time enrollment declined by 4.7% between Fall 2021 and Fall  2022, as opposed to the international graduate first-time enrollment, which increased by 10.2% in the same time frame.",uhcl.edu,,,46.3144754,11.0480288
